{
  "tree": "cafebabecafebabecafebabecafebabecafebabecafebabecafebabecafebabe",
  "def": "a1b2c3d4e5f6a1b2c3d4e5f6a1b2c3d4e5f6a1b2c3d4e5f6a1b2c3d4e5f6a1b2",
  "runner": "runner-01-abc123",
  "model": "claude-sonnet-4-6",
  "principal": [
    "agent:runner-01",
    "user:gustavo"
  ],
  "sig": "MEUCIQDexample+base64+signature=="
}
